{"$schema":"http://json-schema.org/draft-07/schema#","title":"Larum Experience Manifest","type":"object","required":["schemaVersion","revisionId","propertyId","family","themeId","modules","navigation","ctaPolicy","motionPolicy","fallbackPolicy","assetContractIds"],"properties":{"schemaVersion":{"const":"1.0"},"revisionId":{"type":"string"},"propertyId":{"type":"string"},"family":{"enum":["urban-apartment","villa-estate","metropolitan-luxury"]},"themeId":{"type":"string"},"modules":{"type":"array","items":{"type":"object","required":["id","instanceId","visible","order","config"],"properties":{"id":{"type":"string"},"instanceId":{"type":"string"},"visible":{"type":"boolean"},"order":{"type":"number"},"config":{"type":"object"}}}},"navigation":{"type":"object","required":["chapters","defaultEntry"],"properties":{"chapters":{"type":"array","items":{"type":"string"}},"defaultEntry":{"type":"string"}}},"ctaPolicy":{"type":"object"},"motionPolicy":{"type":"object"},"fallbackPolicy":{"type":"object"},"assetContractIds":{"type":"array","items":{"type":"string"}}},"additionalProperties":false}
